{
  "$schema": "https://json-schema.org/draft/2020-12/schema",
  "$id": "https://nhms.invalid/schemas/scheduler_file_provider_refresh_receipt.schema.json",
  "title": "NHMS scheduler file-provider refresh receipt v1",
  "type": "object",
  "additionalProperties": false,
  "required": [
    "schema_version",
    "run_id",
    "started_at",
    "finished_at",
    "outcome",
    "reason",
    "operation_outcome",
    "operation_reason",
    "phase",
    "database_free",
    "providers",
    "orphans",
    "residues"
  ],
  "properties": {
    "schema_version": {"const": "nhms.scheduler.file_provider_refresh_receipt.v1"},
    "run_id": {"type": "string", "minLength": 1, "maxLength": 128, "pattern": "^[A-Za-z0-9_.-]+$"},
    "started_at": {"type": "string", "format": "date-time", "maxLength": 64},
    "finished_at": {"type": "string", "format": "date-time", "maxLength": 64},
    "outcome": {
      "enum": [
        "dry_run",
        "published",
        "already_running",
        "failed",
        "replace_uncertain",
        "restored_previous",
        "published_receipt_failed"
      ]
    },
    "reason": {
      "enum": [
        "success",
        "dry_run_complete",
        "refresh_already_running",
        "configuration_invalid",
        "provider_invalid",
        "provider_preimage_changed",
        "provider_replace_failed",
        "provider_replace_uncertain",
        "provider_postread_failed",
        "workspace_limit_exceeded",
        "orphan_limit_exceeded",
        "primary_receipt_failed",
        "receipt_channels_failed",
        "emergency_record_invalid",
        "registry_cutover_undeclared",
        "registry_cutover_removal_refused",
        "registry_cutover_declaration_invalid"
      ],
      "maxLength": 64
    },
    "operation_outcome": {
      "enum": [
        "dry_run",
        "published",
        "already_running",
        "failed",
        "replace_uncertain",
        "restored_previous",
        "published_receipt_failed"
      ]
    },
    "operation_reason": {
      "enum": [
        "success",
        "dry_run_complete",
        "refresh_already_running",
        "configuration_invalid",
        "provider_invalid",
        "provider_preimage_changed",
        "provider_replace_failed",
        "provider_replace_uncertain",
        "provider_postread_failed",
        "workspace_limit_exceeded",
        "orphan_limit_exceeded",
        "primary_receipt_failed",
        "receipt_channels_failed",
        "emergency_record_invalid",
        "registry_cutover_undeclared",
        "registry_cutover_removal_refused",
        "registry_cutover_declaration_invalid"
      ],
      "maxLength": 64
    },
    "phase": {"type": "string", "minLength": 1, "maxLength": 64},
    "database_free": {"const": true},
    "providers": {
      "type": "array",
      "maxItems": 256,
      "items": {
        "type": "object",
        "additionalProperties": false,
        "required": [
          "name",
          "before_sha256",
          "before_inode",
          "before_schema_version",
          "before_generated_at",
          "before_payload_checksum",
          "after_sha256",
          "after_schema_version",
          "after_generated_at",
          "after_payload_checksum",
          "entry_count"
        ],
        "properties": {
          "name": {"enum": ["registry", "registry_worker_mirror", "readiness", "state"]},
          "before_sha256": {
            "oneOf": [
              {"type": "string", "pattern": "^[0-9a-f]{64}$"},
              {"type": "null"}
            ]
          },
          "before_inode": {"type": ["integer", "null"], "minimum": 0},
          "before_schema_version": {"type": ["string", "null"], "maxLength": 128},
          "before_generated_at": {"type": ["string", "null"], "format": "date-time", "maxLength": 64},
          "before_payload_checksum": {"type": ["string", "null"], "maxLength": 128},
          "after_sha256": {
            "oneOf": [
              {"type": "string", "pattern": "^[0-9a-f]{64}$"},
              {"type": "null"}
            ]
          },
          "after_schema_version": {"type": ["string", "null"], "maxLength": 128},
          "after_generated_at": {"type": ["string", "null"], "format": "date-time", "maxLength": 64},
          "after_payload_checksum": {"type": ["string", "null"], "maxLength": 128},
          "entry_count": {"type": "integer", "minimum": 0}
        }
      }
    },
    "orphans": {
      "type": "object",
      "additionalProperties": false,
      "required": [
        "items",
        "total",
        "discovered_total",
        "attempted_total",
        "created_total",
        "truncated"
      ],
      "properties": {
        "items": {
          "type": "array",
          "maxItems": 256,
          "items": {"type": "string", "pattern": "^package:[0-9a-f]{32}$"}
        },
        "total": {"type": "integer", "minimum": 0, "maximum": 4096},
        "discovered_total": {"type": "integer", "minimum": 0},
        "attempted_total": {"type": "integer", "minimum": 0, "maximum": 4096},
        "created_total": {"type": "integer", "minimum": 0, "maximum": 4096},
        "truncated": {"type": "boolean"}
      }
    },
    "residues": {
      "type": "array",
      "maxItems": 64,
      "items": {"type": "string", "maxLength": 512, "pattern": "^(?!/)(?!.*(?:^|/)\\.\\.(?:/|$)).+$"}
    },
    "cutover_gate": {
      "type": "object",
      "additionalProperties": false,
      "required": ["mode", "declaration_env", "declaration_present"],
      "properties": {
        "mode": {"enum": ["enforced", "bypassed_allow_uncovered_cutover", "not_wired"]},
        "declaration_env": {"type": ["string", "null"], "maxLength": 512},
        "declaration_present": {"type": "boolean"}
      }
    },
    "registry_classification": {
      "type": "object",
      "additionalProperties": false,
      "required": [
        "previous_registry_sha256",
        "new_registry_sha256",
        "previous_model_count",
        "prospective_model_count",
        "added",
        "unchanged",
        "removed",
        "package_changed",
        "refused",
        "declared_cutovers"
      ],
      "properties": {
        "previous_registry_sha256": {
          "oneOf": [
            {"type": "string", "pattern": "^[0-9a-f]{64}$"},
            {"type": "null"}
          ]
        },
        "new_registry_sha256": {
          "oneOf": [
            {"type": "string", "pattern": "^[0-9a-f]{64}$"},
            {"type": "null"}
          ]
        },
        "previous_model_count": {
          "oneOf": [
            {"type": "integer", "minimum": 0, "maximum": 65536},
            {"type": "null"}
          ]
        },
        "prospective_model_count": {"type": "integer", "minimum": 0, "maximum": 65536},
        "mode": {"enum": ["id_only", "full"]},
        "added": {"$ref": "#/$defs/model_id_group"},
        "unchanged": {"$ref": "#/$defs/model_id_group"},
        "removed": {"$ref": "#/$defs/model_id_group"},
        "package_changed": {"$ref": "#/$defs/checksum_group"},
        "refused": {"$ref": "#/$defs/refused_group"},
        "declared_cutovers": {"$ref": "#/$defs/declared_cutover_group"}
      }
    }
  },
  "$defs": {
    "model_id": {"type": "string", "minLength": 1, "maxLength": 128, "pattern": "^[A-Za-z0-9_.:-]+$"},
    "package_checksum": {"type": "string", "pattern": "^[0-9a-f]{64}$"},
    "model_id_group": {
      "type": "object",
      "additionalProperties": false,
      "required": ["items", "total", "truncated"],
      "properties": {
        "items": {
          "type": "array",
          "maxItems": 256,
          "items": {"$ref": "#/$defs/model_id"}
        },
        "total": {"type": "integer", "minimum": 0},
        "truncated": {"type": "boolean"}
      }
    },
    "checksum_group": {
      "type": "object",
      "additionalProperties": false,
      "required": ["items", "total", "truncated"],
      "properties": {
        "items": {
          "type": "array",
          "maxItems": 256,
          "items": {
            "type": "object",
            "additionalProperties": false,
            "required": ["model_id", "old_checksum", "new_checksum"],
            "properties": {
              "model_id": {"$ref": "#/$defs/model_id"},
              "old_checksum": {"$ref": "#/$defs/package_checksum"},
              "new_checksum": {"$ref": "#/$defs/package_checksum"}
            }
          }
        },
        "total": {"type": "integer", "minimum": 0},
        "truncated": {"type": "boolean"}
      }
    },
    "refused_group": {
      "type": "object",
      "additionalProperties": false,
      "required": ["items", "total", "truncated"],
      "properties": {
        "items": {
          "type": "array",
          "maxItems": 256,
          "items": {
            "type": "object",
            "additionalProperties": false,
            "required": ["model_id", "reason"],
            "properties": {
              "model_id": {"$ref": "#/$defs/model_id"},
              "old_checksum": {
                "oneOf": [
                  {"$ref": "#/$defs/package_checksum"},
                  {"type": "null"}
                ]
              },
              "new_checksum": {
                "oneOf": [
                  {"$ref": "#/$defs/package_checksum"},
                  {"type": "null"}
                ]
              },
              "reason": {
                "enum": [
                  "registry_cutover_undeclared",
                  "registry_cutover_removal_refused",
                  "registry_cutover_declaration_invalid"
                ],
                "maxLength": 64
              }
            }
          }
        },
        "total": {"type": "integer", "minimum": 0},
        "truncated": {"type": "boolean"}
      }
    },
    "declared_cutover_group": {
      "type": "object",
      "additionalProperties": false,
      "required": ["items", "total", "truncated"],
      "properties": {
        "items": {
          "type": "array",
          "maxItems": 256,
          "items": {
            "type": "object",
            "additionalProperties": false,
            "required": [
              "model_id",
              "old_checksum",
              "new_checksum",
              "effective_cycle_utc",
              "transition_mode"
            ],
            "properties": {
              "model_id": {"$ref": "#/$defs/model_id"},
              "old_checksum": {"$ref": "#/$defs/package_checksum"},
              "new_checksum": {"$ref": "#/$defs/package_checksum"},
              "effective_cycle_utc": {"type": "string", "format": "date-time", "maxLength": 64},
              "transition_mode": {"enum": ["replace"]}
            }
          }
        },
        "total": {"type": "integer", "minimum": 0},
        "truncated": {"type": "boolean"}
      }
    }
  },
  "allOf": [
    {
      "if": {"properties": {"outcome": {"enum": ["published", "dry_run"]}}, "required": ["outcome"]},
      "then": {
        "required": ["registry_classification"],
        "properties": {
          "providers": {
            "oneOf": [
              {
                "minItems": 3,
                "maxItems": 3,
                "prefixItems": [
                  {"properties": {"name": {"const": "registry"}}},
                  {"properties": {"name": {"const": "readiness"}}},
                  {"properties": {"name": {"const": "state"}}}
                ]
              },
              {
                "minItems": 4,
                "maxItems": 4,
                "prefixItems": [
                  {"properties": {"name": {"const": "registry"}}},
                  {"properties": {"name": {"const": "registry_worker_mirror"}}},
                  {"properties": {"name": {"const": "readiness"}}},
                  {"properties": {"name": {"const": "state"}}}
                ]
              }
            ]
          }
        }
      }
    },
    {
      "if": {
        "properties": {
          "reason": {
            "enum": [
              "registry_cutover_undeclared",
              "registry_cutover_removal_refused",
              "registry_cutover_declaration_invalid"
            ]
          }
        },
        "required": ["reason"]
      },
      "then": {"required": ["registry_classification"]}
    }
  ]
}
